{"algorithm_version":"transferable-rolling-npxg-for-against-dixon-coles-v2","artifact_schema_version":"TransferableRollingNpxgForAgainstDixonColesV2ArtifactV1","compatibility_declaration":"development-research-only; no production or confirmation authorization","configuration_sha256":"5ff4ef212931d5aeeb94b5dd3b3c905d276088a7775f85d54e1ce73e7605f517","dependency_lock_sha256":"d14def6539f213b2af3011975062ed3e1e0bba2d86e8064803bd3d86d0a39e4e","feature_contract_sha256":"8118e1ace04b1835f93c6df8de35e590a3ed7272d7e1ae029aafe4a1e56ea50d","football_cutoff":"2026-05-16T13:30:00+00:00","knowledge_cutoff":"2026-05-16T13:30:00+00:00","knowledge_mode":"RETROSPECTIVE_SNAPSHOT_POINT_IN_TIME_REPLAY","logical_state_sha256":"3f19adf6d024c287b2800deba7f1dd5e2b9eb147c2ab831b0a3acaddfd8528dc","parameters":{"competition_baseline_deviations":{"Bundesliga":0.0155243332539707,"La Liga":-0.010073144942484671,"Premier League":0.005772383896473249,"Serie A":-0.011223572207959278},"competition_home_advantage_deviations":{"Bundesliga":0.010071406030061677,"La Liga":-0.003443357210139978,"Premier League":5.288317582252018e-05,"Serie A":-0.006680931995744219},"global_home_advantage":0.12640002879406878,"global_intercept":0.3172907165982745,"goals_against_weight":0.09832480281863999,"goals_for_weight":0.15623515801990134,"npxg_against_weight":0.4680193467771248,"npxg_for_weight":0.6835957270152437,"regularization":[10.0,10.0,25.0],"rho":0.0001840405068689061},"research_id":"TRANSFERABLE_ROLLING_NPXG_FOR_AGAINST_DIXON_COLES_V2_RESEARCH_V1","serializer_version":"canonical-json-sort-keys-compact-v1","source_commit":"951c17f0d3ef570609b11a76d7a565898e32017f","team_id_parameters":false,"training_dataset_sha256":"2ace8fb86f8881dae1baeb5c7cdb277e1174e124eb264def17f658b9550c2193","training_target_count":1270}
